{
  "schema": "minhtri-current-boot-recovery-response/v4",
  "challenge_id": "ARCH-FOUNDATION-FREEZE-CURRENT-BOOT-20261006-C4",
  "challenge_nonce": "mtc4-4d8d812f2f3b46a9916255cb3f1da21e",
  "attestations": {
    "separate_zero_chat": true,
    "used_prior_chat_history": false,
    "read_snapshot": false
  },
  "recovered_facts": {
    "boot": {
      "boot_root_ref": "state/bootstrap.json",
      "durable_continuity_authority": "GITHUB_PROTECTED_MAIN",
      "current_state_ref": "state/current.yaml",
      "task_registry_ref": "state/tasks.yaml",
      "role_bootstrap_ref": "docs/GITHUB_FIRST_ROLE_BOOTSTRAP_20261002.md",
      "recovery_entrypoint_ref": "docs/vnext/continuity/RECOVERY_ENTRYPOINT_V1.md",
      "current_architecture_ref": "docs/vnext/ARCHITECTURE_VNEXT_OWNER_APPROVED_CANDIDATE_20261006.md",
      "fail_closed_on_missing_or_conflicting_required_pointer": true
    },
    "law": {
      "law_precedence_ref": "docs/vnext/FOUNDATION_LAW_CONSOLIDATED_V1_20261006.md",
      "law_index_catalog_ref": "docs/LAW_INDEX_20261003.md",
      "law_index_catalog_has_independent_precedence": false,
      "bootstrap_and_current_state_law_precedence_agree": true,
      "source_law_history_preserved": true
    },
    "active_task": {
      "task_id": "ARCH-FOUNDATION-ACCEPTANCE-FREEZE-V1",
      "status": "IN_PROGRESS",
      "handoff_ref": "docs/vnext/handoff/FOUNDATION_ACCEPTANCE_FREEZE_V1.md",
      "requires": "none",
      "blocker": "CURRENT_BOOT_PATH_FRESH_SEAT_PROOF_AND_TWO_V2_RED_TEAM_RECEIPTS_REQUIRED",
      "next_action": "Run current boot-path fresh-seat Recovery Proof v4 from eval/recovery/v4/challenge.json; after deterministic PASS plus durable independence receipt, build one repaired Red-Team Packet v2 and run that identical packet independently in Claude and Grok."
    },
    "canonicality": {
      "current_architecture_is_canonical": true,
      "chat_memory_is_canonical": false,
      "unmerged_branch_is_canonical": false,
      "pc_local_brain_is_canonical": false,
      "legacy_migrated_keys_override_current": false,
      "legacy_records_authoritative_for_unmigrated_keys_only": true,
      "architecture_generation": "VNEXT_FOUNDATION_FREEZE_CANDIDATE",
      "phase": "FOUNDATION_ACCEPTANCE",
      "foundation_baseline_status": "CANDIDATE_PENDING_RED_TEAM_AND_FREEZE",
      "foundation_frozen": false
    },
    "capability_truth": {
      "historical_c3_current_path_proof": false,
      "historical_c3_proof_scope": "C3_FIXTURE_ONLY",
      "current_boot_path_recovery_status": "NOT YET PROVEN_FOR_FREEZE",
      "cross_provider_critic_independence_status": "NOT YET PROVEN_FOR_FREEZE",
      "single_boot_root_status": "PROVEN_BY_CI_AND_CANONICAL_MERGE",
      "semantic_staleness_status": "PROVEN_AS_DETERMINISTIC_GUARD_PRIMITIVE",
      "knowledge_fast_lane_status": "PROVEN_AS_BOUNDED_VALIDATION_CONTRACT",
      "retrieval_application_status": "PROVEN_FOR_FIXTURE_ONLY",
      "autonomous_learning_runtime": false,
      "automatic_self_critique_runtime": false,
      "meta_learning_runtime": false,
      "autonomous_merge": false,
      "knowledge_learning_requires_owner_pc": false,
      "pc_local_brain_role": "NON_CANONICAL_EXECUTION_AND_MIRROR_SIDECAR",
      "global_memory_or_universal_understanding_proven": false
    },
    "next_gate": {
      "current_boot_path_fresh_seat_recovery_required": true,
      "recovery_challenge_ref": "eval/recovery/v4/challenge.json",
      "deterministic_score_required": "PASS",
      "owner_attested_independent_fresh_seat_provenance_required": true,
      "durable_receipt_merged_required": true,
      "red_team_packet_version_required": "v2",
      "claude_red_team_required": true,
      "grok_red_team_required": true,
      "final_critics_must_bind_identical_repaired_packet": true,
      "material_defects_resolved_required": true,
      "foundation_freeze_permitted_now": false
    }
  },
  "evidence_refs": [
    "eval/recovery/v4/challenge.json",
    "eval/recovery/v4/packet.json",
    "eval/recovery/v4/response.schema.json",
    "state/bootstrap.json",
    "docs/vnext/FOUNDATION_LAW_CONSOLIDATED_V1_20261006.md",
    "state/current.yaml",
    "state/tasks.yaml",
    "docs/vnext/handoff/FOUNDATION_ACCEPTANCE_FREEZE_V1.md",
    "docs/LAW_INDEX_20261003.md",
    "docs/GITHUB_FIRST_ROLE_BOOTSTRAP_20261002.md",
    "docs/vnext/continuity/RECOVERY_ENTRYPOINT_V1.md",
    "docs/vnext/ARCHITECTURE_VNEXT_OWNER_APPROVED_CANDIDATE_20261006.md",
    "docs/vnext/FOUNDATION_CAPABILITY_TRUTH_MATRIX_V1_20261006.md",
    "docs/vnext/FOUNDATION_DEBT_REGISTER_V1_20261006.md",
    "docs/vnext/FOUNDATION_BASELINE_V1.json",
    "docs/vnext/FOUNDATION_FREEZE_RED_TEAM_PACKET_V1_20261006.md"
  ],
  "answers": {
    "Q1": "Fresh reads began with the v4 challenge on main. GitHub reported main protected at cb2176111bf2759349e12488c11f2eb04580b27a, and its head remained unchanged through the reads. The recovered route is state/bootstrap.json -> docs/vnext/FOUNDATION_LAW_CONSOLIDATED_V1_20261006.md -> state/current.yaml -> state/tasks.yaml -> docs/vnext/handoff/FOUNDATION_ACCEPTANCE_FREEZE_V1.md -> the active task's exact next_action.",
    "Q2": "The consolidated foundation law owns normative precedence. LAW_INDEX_20261003.md is a discovery catalog with no independent precedence authority. Bootstrap and current state point to the same consolidated law. Durable constitution-level Owner decisions precede Stable Law, Policy, Domain Rule, and ADR or bounded operational decisions; current state and tasks provide operational truth. Same-level conflicts require explicit supersession or bounded resolution, and unresolved required authority fails closed.",
    "Q3": "Current state selects ARCH-FOUNDATION-ACCEPTANCE-FREEZE-V1. Its registry status is IN_PROGRESS, requires is none, and its handoff agrees with the registry: run Recovery Proof v4 first, require deterministic PASS and durable independent provenance, then build one repaired v2 packet for independent Claude and Grok reviews. The blocker is CURRENT_BOOT_PATH_FRESH_SEAT_PROOF_AND_TWO_V2_RED_TEAM_RECEIPTS_REQUIRED.",
    "Q4": "Protected main supplies durable continuity authority. The architecture referenced by current state is canonical despite CANDIDATE remaining in its filename; the foundation baseline is still a freeze candidate. Chat memory, unmerged branches, and PC sidecars cannot override canonical main. Legacy state remains available for unmigrated keys and history but cannot override migrated current-state or task fields.",
    "Q5": "Historical C3 proves its fixture at the pre-Single-Boot-Root proof-time state, not the repaired bootstrap and consolidated-law route. Retrieval/Application proves its fixture only. Semantic and Fast-Lane validators are bounded primitives rather than universal enforcement. Autonomous learning, automatic self-critique, and meta-learning runtimes remain OFF; autonomous merge is forbidden in the foundation.",
    "Q6": "Complete the current-path fresh-seat proof with deterministic PASS, Owner-attested independent provenance, and a merged durable receipt. Then freeze Red-Team Packet v2 and obtain Claude and Grok receipts bound to the identical repaired packet. Resolve remaining material defects before final foundation freeze. This response does not itself establish a grading PASS, independence receipt, or completed freeze. Optional salvage, PC runtime debt, and incomplete knowledge coverage do not independently block freeze."
  }
}
